study,name,label,label_de,description,description_de
scp,track,Tracking,Struktur-/Pfad-Daten,Essential files to track persons or household over time,
scp,org/gross,Gross,Brutto-Daten,"Information on gross sample, mostly from the field work",
scp,org/net,Original,Fragebogendaten (netto),"Information from succesfull interviewed respondents, mostly based on a questionnaire",
scp,survey,Survey,Methodendaten,Dataset describing the survey design or weighting scheme,
scp,gen,Generated,Generierte Daten,"Generated data, checked for longitudinally consistency",
scp,gen/bio,Gen. Biographical,Generierte Bio-Daten,"Generated biographical data, checked for longitudinally consistency",
scp,spell,Spell,,Spell data,
scp,raw,Raw data (undistributed),Rohdaten (nicht veröffentlicht),Undistributed original datasets,
